Tableau/Vehicle Data_Clean.csv

State,Electric (EV),Plug-In Hybrid Electric (PHEV),Hybrid Electric (HEV),Biodiesel,Ethanol/Flex (E85),Compressed Natural Gas (CNG),Propane,Hydrogen,Methanol,Gasoline,Diesel,Unknown Fuel,EV%
Alabama,13000,5800,63300,54200,441200,100,100,0,0,4102200,127000,29000,0.002688228
Alaska,2700,900,10600,9600,46800,0,0,0,0,454300,29800,5100,0.004823151
Arizona,89800,25600,175700,68600,437100,600,700,0,0,5469000,197700,64200,0.013754021
Arkansas,7100,3200,37000,37000,276700,200,0,0,0,2246100,90700,10300,0.002621571
California,1256600,410700,1703200,201600,1314600,10100,1500,16900,0,31191900,735300,7900,0.034100129
Colorado,90100,37500,152700,68100,334300,300,100,0,0,4508800,203400,46500,0.016557022
Connecticut,31600,18400,75300,10900,133600,100,0,0,0,2612600,42300,20900,0.010727501
Delaware,8400,3800,22900,5100,63900,0,0,0,0,791300,14200,5100,0.009183339
District of Columbia,8100,3700,18100,400,16800,100,0,0,0,262500,1800,600,0.02595322
Florida,254900,57300,414500,170500,1101100,400,100,0,0,16136500,351800,96100,0.01371669
Georgia,92400,22700,175300,92500,719400,300,200,0,0,8256400,206300,76900,0.009582677
Hawaii,25600,7300,36400,3400,37300,0,0,0,0,951000,15400,3700,0.023701509
Idaho,8500,4600,43700,45900,132900,100,100,0,0,1568600,138600,31600,0.004304669
Illinois,99600,33400,285400,61500,772900,300,0,0,0,8560300,170200,59600,0.009917158
Indiana,26100,12900,119100,56300,576300,300,0,0,0,5166200,156400,58500,0.004228707
Iowa,9000,6100,57200,41700,331300,100,0,0,0,2545400,105000,57500,0.002854153
Kansas,11300,5600,50400,27900,253500,200,100,0,0,2168600,87400,16100,0.004311167
Kentucky,11600,5600,67100,36900,361200,300,0,0,0,3415000,117600,24400,0.0028715
Louisiana,8200,4000,40200,64200,380100,100,0,0,0,3142800,115500,19100,0.002172646
Maine,7400,7600,33600,12000,104500,0,0,0,0,1036100,26900,7900,0.005987055
Maryland,72100,31300,168700,32100,309300,300,0,0,0,4327800,86900,31500,0.014249012
Massachusetts,73800,43800,187300,21300,285000,200,0,0,0,4791300,58400,30000,0.01343993
Michigan,50300,29100,148100,70400,873700,300,0,0,0,7129600,174500,49400,0.005900016
Minnesota,37100,16100,124500,52700,516400,100,0,0,0,4219200,127900,24500,0.007248217
Mississippi,3600,2000,28200,34900,295200,100,0,0,0,2275600,75200,8500,0.001321926
Missouri,26900,13900,113900,70400,575500,900,100,0,0,4608600,178200,37600,0.004781372
Montana,4600,2500,21100,37900,94500,0,0,0,0,780700,69600,10800,0.0045023
Nebraska,6900,3800,32600,28900,197100,100,0,0,0,1600400,76100,25300,0.003500406
Nevada,47400,10600,69600,27200,125600,200,100,0,0,2169300,85800,20300,0.018543875
New Hampshire,9900,6600,36800,13900,89600,100,0,0,0,1185300,29200,12300,0.00715473
New Jersey,134800,40900,174200,27800,392100,300,0,0,0,6433000,84600,36400,0.018404992
New Mexico,10300,4900,44300,32100,151600,100,100,0,0,1597600,88500,22900,0.005275558
New York,131300,92300,314000,54300,591100,400,100,0,0,9905500,150500,79100,0.011600375
North Carolina,70200,23700,210600,80200,655000,300,100,0,0,7764000,209700,71700,0.007726597
North Dakota,1000,800,8200,20400,89900,0,0,0,0,625300,44600,7200,0.001254076
Ohio,50400,24000,199800,70300,833500,700,100,0,0,8881400,196200,60900,0.004884999
Oklahoma,22800,33000,56400,63100,352400,1800,200,0,0,3567500,145700,45000,0.005317288
Oregon,64400,28800,156900,55500,184600,100,100,0,0,3074300,217000,51000,0.016802776
Pennsylvania,70200,38900,245400,73900,661700,500,100,0,0,8886400,192100,41800,0.006874939
Rhode Island,6400,5100,22100,3100,41900,0,0,0,0,782000,11000,6000,0.007292616
South Carolina,20900,9000,83100,44600,404600,100,100,0,0,4325000,110100,44900,0.004144852
South Dakota,1700,1300,11900,21500,98800,0,0,0,0,718300,51200,13300,0.001851852
Tennessee,33200,11000,113300,53100,509000,200,100,0,0,5620500,160700,37700,0.005077384
Texas,230100,55300,445100,460700,2315400,1300,1300,0,0,21392800,772800,121800,0.00891978
Utah,40000,13000,83200,68500,185200,2200,500,0,0,2499600,158000,26000,0.013003056
Vermont,7800,5700,20300,7000,36600,0,0,0,0,496000,14700,5000,0.013151239
Virginia,84900,26800,229400,44300,484800,300,0,0,0,6670000,152800,30200,0.010992426
Washington,152100,41200,307200,73800,337700,100,100,0,0,5583000,274200,46700,0.022314813
West Virginia,2800,1800,22400,17300,123400,100,0,0,0,1281500,46400,15200,0.0018532
Wisconsin,24900,12500,123600,52900,536200,300,0,0,0,4604700,147500,26400,0.004503527
Wyoming,1100,800,8400,21200,57700,0,0,0,0,489100,60900,13700,0.001684791

README.md

#### Key Findings

* Gasoline vehicles dominate across all states, accounting for over 80% of total registered vehicles.
 * EV adoption rates remain relatively low nationwide, with the highest shares observed in California (3.41%), followed by the District of Columbia (2.60%) and Hawaii (2.37%).
 * The District of Columbia records the highest PHEV (1.19%) and HEV (5.80%) shares, indicating stronger hybrid adoption relative to most states. HEVs demonstrate broader appeal compared to EVs and PHEVs across the majority of states.
 * The lowest EV, PHEV, and HEV adoption rates are observed in states such as North Dakota and Mississippi, highlighting regional disparities in electrification.

### Key Findings

* California’s EV adoption rate (3.41%) significantly exceeds that of other large states such as Florida (1.37%), New York (1.16%), and Texas (0.89%).